{
  "$schema": "http://json-schema.org/draft-07/schema#",
  "$id": "https://github.com/aksOps/codex-plugin-cc/schemas/policy.schema.json",
  "title": "Codex plugin execution policy",
  "description": "Capability policy for write-capable Codex agents. Lives at .codex-plugin/policy.json in the repository root. When this file is absent or invalid the plugin denies every write capability and only read-only agents run. This schema documents the shape for editors; the plugin enforces it with hand-written validation in scripts/lib/policy.mjs.",
  "type": "object",
  "additionalProperties": false,
  "required": ["version", "agents"],
  "properties": {
    "version": {
      "const": 1,
      "description": "Policy format version. An unrecognized version denies all write capability."
    },
    "agents": {
      "type": "object",
      "description": "Per-agent capability. Agents absent from this map cannot write.",
      "additionalProperties": {
        "type": "object",
        "additionalProperties": false,
        "required": ["capability"],
        "properties": {
          "capability": {
            "enum": ["read", "write"]
          },
          "writableGlobs": {
            "type": "array",
            "minItems": 1,
            "description": "Repository-relative globs the agent may modify. Required for write agents. Supports *, ?, and **. Absolute paths and .. are rejected.",
            "items": {
              "type": "string",
              "minLength": 1
            }
          }
        }
      }
    },
    "verification": {
      "type": "array",
      "description": "Structured verification commands run inside the job worktree. argv arrays only: no shell string is ever evaluated.",
      "items": {
        "type": "object",
        "additionalProperties": false,
        "required": ["id", "argv"],
        "properties": {
          "id": { "type": "string", "minLength": 1 },
          "argv": {
            "type": "array",
            "minItems": 1,
            "items": { "type": "string" }
          },
          "expect": {
            "type": "object",
            "additionalProperties": false,
            "properties": {
              "exitCode": { "type": "integer" }
            }
          },
          "required": {
            "type": "boolean",
            "description": "Defaults to true. A failing required check blocks completion and landing."
          }
        }
      }
    },
    "limits": {
      "type": "object",
      "additionalProperties": false,
      "properties": {
        "maxDurationMs": { "type": "integer", "minimum": 1 },
        "maxOutputBytes": { "type": "integer", "minimum": 1 },
        "maxConcurrentJobs": { "type": "integer", "minimum": 1 },
        "network": { "enum": ["off", "on"] },
        "envPassthrough": {
          "type": "array",
          "items": { "type": "string" },
          "description": "Environment variable names forwarded to spawned Codex processes. Everything else is stripped."
        }
      }
    },
    "landing": {
      "type": "object",
      "additionalProperties": false,
      "properties": {
        "allowAutoLand": {
          "type": "boolean",
          "description": "When false, a verified diff is never landed automatically regardless of the host permission mode."
        },
        "requireCleanTree": {
          "type": "boolean",
          "description": "When true, landing refuses if the target working tree has uncommitted changes."
        }
      }
    }
  }
}
